market,sector,symbol,symbol_name,description,link_website,one_report_link,last_updated_at
SET,PF&REIT,MII,ทรัสต์เพื่อการลงทุนในอสังหาริมทรัพย์และสิทธิการเช่า เอ็มเอฟซี อินดัสเตรียล อินเวสเมนท์,กองทรัสต์เข้าลงทุนในทรัพย์สินกรรมสิทธิ์ที่ดินและอาคารโรงงานอุตสาหกรรมในนิคมอุตสาหกรรมทีเอฟดี จำนวน 16 โรง และโรงงานในเขตส่งเสริมอุตสาหกรรมนวนคร จำนวน 1 โรง สิทธิการเช่าและเช่าช่วงในที่ดินเนื้อที่รวม 29 ไร่ และกรรมสิทธิ์ในอาคาร โรงงานอุตสาหกรรมในนิคมอุตสาหกรรมแหลมฉบังจํานวน 18 หลัง อายุสัญญาเช่าสิ้นสุด 17 ธันวาคม 2585 และ สิทธิการเช่าและเช่าช่วงในที่ดินเนื้อที่รวม 25 ไร่ และกรรมสิทธิ์ในอาคารพาณิชย์-ส่านักงานจำนวน 17 หลังบนถนนกิ่งแก้ว อายุสัญญาเช่าสิ้นสุด 19 กุมภาพันธ์ 2579,,https://weblink.set.or.th/dat/annual/2011ANN020420261516546580T.zip,2026-05-13T13:03:00
SET,STEEL,MILL,บริษัท มิลล์คอน สตีล จำกัด (มหาชน),กลุ่มบริษัท มิลล์คอน สตีล จำกัด (มหาชน) หรือ มิลล์คอน (MILLCON) คือหนึ่งในผู้ผลิตและจำหน่ายผลิตภัณฑ์เหล็กแบบครบวงจร มีผลิตภัณฑ์ที่หลากหลายผ่านการรับรองคุณภาพจากหน่วยงานทั้งในประเทศและนานาชาติ บริษัทฯ มุ่งเน้นการพัฒนาขีดความสามารถในการดำเนินงานเพื่อสร้างคุณค่าแก่กลุ่มธุรกิจ ด้วยกลยุทธ์การดำเนินธุรกิจหลัก 3 กลุ่ม ผ่านแนวคิดการเป็นมากกว่าเหล็ก ?THINK BEYOND STEEL? ได้แก่ 1. กลุ่มธุรกิจวัสดุก่อสร้าง (Construction Material) ด้วยการครอบคลุมทั้งห่วงโซ่อุปทาน (Supply Chain) ตั้งแต่ต้นน้ำจนถึงปลายน้ำ 2. มุ่งเน้นการผลิตเหล็กเกรดพิเศษ (Special Steel) เพื่อขยายตลาดเข้าสู่กลุ่มอุตสาหกรรมรถยนต์ 3. การลงทุนในกลุ่มธุรกิจที่เกี่ยวข้อง (Supporting Core Business) เพื่อสนับสนุนการดำเนินงานของบริษัท และตอบสนองความต้องการผู้บริโภคในทุกมิติของธุรกิจ,http://www.millconsteel.com/,https://weblink.set.or.th/dat/f56/0957ONE010420251902220015T.zip,2026-05-13T13:03:05
SET,TOURISM,MINT,บริษัท ไมเนอร์ อินเตอร์เนชั่นแนล จำกัด (มหาชน),ประกอบธุรกิจด้านการลงทุนในบริษัทย่อยและบริษัทร่วมที่ดำเนินธุรกิจอาหารและเครื่องดื่ม ธุรกิจโรงแรมและธุรกิจอื่น ๆ ที่เกี่ยวข้องกับธุรกิจโรงแรม ซึ่งรวมถึงโครงการพัฒนาที่อยู่อาศัยเพื่อขาย โครงการพักผ่อนแบบปันส่วนเวลา และให้เช่าศูนย์การค้าและอสังหาริมทรัพย์ และธุรกิจบันเทิงและธุรกิจจัดจำหน่าย,http://www.minor.com/,https://weblink.set.or.th/dat/f56/0128ONE270320261218180617T.zip,2026-05-13T13:02:58
SET,PF&REIT,MIPF,กองทุนรวมอสังหาริมทรัพย์มิลเลียนแนร์,ลงทุน (freehold) ในอาคารสำนักงานมาลีนนท์ทาวเวอร์ และอาคาร Production House ตั้งอยู่บนถนนพระราม 4,,https://weblink.set.or.th/dat/annual/0827ANN260320261631310511T.zip,2026-05-13T13:03:49
mai,FINCIAL,MITSIB,บริษัท มิตรสิบ ลิสซิ่ง จำกัด (มหาชน),ธุรกิจสินเชื่อเช่าซื้อ,http://www.mitsibleasing.com/,https://weblink.set.or.th/dat/f56/1492E1N180320262008590090T.zip,2026-05-13T13:03:09
SET,PROP,MJD,บริษัท เมเจอร์ ดีเวลลอปเม้นท์ จำกัด (มหาชน),พัฒนาอสังหาริมทรัพย์เพื่อขายและธุรกิจโรงแรม โดยเน้นโครงการอาคารที่อยู่อาศัยประเภทอาคารสูง หรือ คอนโดมิเนียม ในระดับไฮเอนด์ ที่มีความหรูหราในการอยู่อาศัย,http://www.mjd.co.th/,https://weblink.set.or.th/dat/f56/0960ONE310320261013290718T.zip,2026-05-13T13:03:12
SET,PF&REIT,MJLF,กองทุนรวมสิทธิการเช่าอสังหาฯ เมเจอร์ ซีนีเพล็กซ์ ไลฟ์สไตส์,ลงทุนในสิทธิการเช่า (leasehold) ในอาคารไลฟ์เอนเตอร์เทนเม้นท์ คอมเพล็กซ์ ขนาดใหญ่ ได้แก่ อาคารโครงการเมเจอร์ ซีนีเพล็กซ์ รัชโยธิน และอาคารโครงการเมเจอร์ ซีนีเพล็กซ์ รังสิต และสิทธิการเช่าที่ดินและสิทธิการเช่าพื้นที่บางส่วนของโครงการศูนย์การค้าไลฟ์สไตล์ ซูซูกิ อเวนิว รัชโยธิน,,https://weblink.set.or.th/dat/annual/0948ANN300320261553210621T.zip,2026-05-13T13:04:26
SET,PROP,MK,บริษัท มั่นคงเคหะการ จำกัด (มหาชน),พัฒนาอสังหาริมทรัพย์เพื่อขาย เพื่อการให้เช่าและบริการ,http://www.mk.co.th/,https://weblink.set.or.th/dat/f56/0182ONE270320261704560478T.zip,2026-05-13T13:04:01
SET,FIN,ML,บริษัท ไมด้า ลิสซิ่ง จำกัด (มหาชน),ให้บริการสินเชื่อเช่าซื้อรถยนต์ โดยเน้นประเภทรถยนต์มือสอง และรุ่นของรถยนต์ที่มีสภาพคล่องสูงในตลาดทั้งรถยนต์ส่วนบุคคลและรถกระบะ ให้บริการสินเชื่อประเภทเงินทุนหมุนเวียน (Floor Plan) ให้กับผู้ประกอบการเต็นท์รถยนต์มือสอง ให้บริการหลังการขาย โดยการให้บริการรับต่อทะเบียนรถยนต์ กรมธรรม์ประกันภัย และ พ.ร.บ. คุ้มครองผู้ประสบภัยทางรถยนต์และบริหารสินทรัพย์ด้อยคุณภาพ,http://www.mida-leasing.com/,https://weblink.set.or.th/dat/f56/0785ONE310320261714350626T.zip,2026-05-13T13:04:22
mai,PROPCON,MMM,บริษัท เอ็มเอ็มเอ็ม แคปปิตอล จำกัด (มหาชน),1.ตัวแทนการขายอสังหาริมทรัพย์เพื่อการอยู่อาศัยทุกประเภทให้กับเจ้าของโครงการ เช่น บ้านเดี่ยว บ้านแฝด บ้านทาวน์โฮม และคอนโดมิเนียม เป็นต้น ผ่านเครือข่ายนายหน้าอิสระ 2.ซื้อขายอสังหาริมทรัพย์เพื่อการอยู่อาศัยมือสอง โดยนำมาปรับปรุงซ่อมแซมให้อยู่ในสภาพที่ดีก่อนนำออกจำหน่ายผ่านเครือข่ายนายหน้าอิสระ,https://www.mmm.co.th/,https://weblink.set.or.th/dat/f56/2025E1N050320261129280014T.zip,2026-05-13T13:03:12
SET,PF&REIT,MNIT,กองทุนรวมอสังหาริมทรัพย์เอ็มเอฟซี-นิชดาธานี,ลงทุน (freehold) ใน 1. Lakeshore-North Apartment Building ให้เช่า 2. Lakeshore-West Apartment Building ให้เช่า 3. ที่ดินพร้อมบ้านเดี่ยวพักอาศัย 2 ชั้น ของโครงการ Raintree Residence Project และ 4. ที่ดินพร้อมบ้านเดี่ยวพักอาศัย 2 ชั้น ของโครงการ Sunshine Place Project ซึ่งทั้ง 4 โครงการตั้งอยู่ใน Nichada Thani Project จังหวัดนนทบุรี,http://www.mfcfund.com/,https://weblink.set.or.th/dat/annual/0852ANN030420261100590068T.zip,2026-05-13T13:03:15
SET,PF&REIT,MNIT2,กองทุนรวมอสังหาริมทรัพย์นิชดาธานี 2,ลงทุน (freehold) ในที่ดินและสิ่งปลูกสร้าง รวมถึงเฟอร์นิเจอร์ อุปกรณ์ตกแต่งและเครื่องมือและทรัพย์สินอื่นๆ ดังนี้ 1) ที่ดินพร้อมบ้านเดี่ยว 2 ชั้น ตั้งอยู่ใน The Regent Project 1 และ 2) ที่ดินพร้อมบ้านเดี่ยว 2 ชั้น ตั้งอยู่ใน The Regent Project 2 อำเภอปากเกร็ด จังหวัดนนทบุรี,http://www.mfcfund.com/,https://weblink.set.or.th/dat/annual/1000ANN030420261103020444T.zip,2026-05-13T13:03:09
SET,PF&REIT,MNRF,กองทุนรวมอสังหาริมทรัพย์มัลติเนชั่นแนลเรสซิเดนซ์ฟันด์,ลงทุนโดยซื้อกรรมสิทธิ์ในที่ดินพร้อมสิ่งปลูกสร้าง (freehold) 2 โครงการ และห้องชุดจำนวน 1 โครงการ ดังนี้ 1. โครงการปาล์มทรีเพลส 2. โครงการนิชดา แอท อีสเทิร์น ซีบอร์ด 3. โครงการอาคารชุดดนิชาการ์เด้นท์คอนโดมิเนียม,http://www.mfcfund.com/,https://weblink.set.or.th/dat/annual/0983ANN030420261105040693T.zip,2026-05-13T13:04:01
SET,HOME,MODERN,บริษัท โมเดอร์นฟอร์มกรุ๊ป จำกัด (มหาชน),ผลิตและจำหน่ายเฟอร์นิเจอร์สำเร็จรูป เพื่อจำหน่ายภายในประเทศ และต่างประเทศ พร้อมทั้งนำเข้าวัสดุอุปกรณ์เฟอร์นิเจอร์ และวัสดุเพื่อการตกแต่งภายใน,https://www.modernform.co.th/,https://weblink.set.or.th/dat/f56/0291E1N060320261255370865T.zip,2026-05-13T13:03:18
SET,MEDIA,MONO,บริษัท โมโน เน็กซ์ จำกัด (มหาชน),กลุ่มบริษัท โมโน เน็กซ์ แบ่งการประกอบธุรกิจออกเป็น 4 ธุรกิจ ประกอบด้วย 1. ธุรกิจสื่อทีวี (MONO29) 2. ธุรกิจบริการวิดีโอสตรีมมิ่งแบบบอกรับสมาชิก (Monomax) 3. ธุรกิจให้บริการออกแบบธุรกิจออนไลน์ครบวงจร (Marketing Solution และ เว็บไซต์ MThai.com) 4. ธุรกิจจัดสรรคอนเทนต์ (Master Content Provider) สำหรับ IPTV,http://www.mono.co.th/,https://weblink.set.or.th/dat/f56/1135ONE260320262024160545T.zip,2026-05-13T13:03:23
mai,CONSUMP,MOONG,บริษัท มุ่งพัฒนา อินเตอร์แนชชั่นแนล จำกัด (มหาชน),"บริษัทจัดจำหน่ายสินค้าอุปโภคบริโภค และเป็นตัวแทนจำหน่ายสินค้า โดยมีธุรกิจหลัก ได้แก่ 1) จำหน่ายสินค้าภายใต้แบรนด์ของบริษัทฯ, 2) เป็นตัวแทนจัดจำหน่ายสินค้า และ 3) ธุรกิจร่วมค้า",http://www.moongpattana.com/,https://weblink.set.or.th/dat/f56/1020ONE200320261723310387T.zip,2026-05-13T13:04:38
mai,SERVICE,MORE,บริษัท มอร์ รีเทิร์น จำกัด (มหาชน),"การประกอบธุรกิจของกลุ่มบริษัท1) ส่วนง??านสาธารณูปโภค การผลิดและจำหน่ายน้ำประปา และงานวางระบบน้ำประปาเพื่อบริหารจัดการน้ำประปาบนเกาะเสม็ด และบริเวณพื้นที่โดยรอบในอำเภอปลวงแดง จังหวัดระยอง ซึ่งดำเนินการโดยบริษัทย่อยคือ บริษัท เสม็ดยูทิลิตี้ส์ จำกัด (?Samed Utilities?)บริษัท ปลวกแดง จำกัด (?PLD?)บริษัท เค วอเตอร์เวิร์ค เอ็นจิเนียริ่ง จำกัด (?KWATER?)3) ส่วนงานบริการ รับบริหารจัดการด้านบุคลากร 4) ธุรกิจด้านการพัฒนาอสังหาริมทรัพย์ ดำเนินการโดยบริษัทย่อยคือ บริษัท มอร์ พร็อพเพอร์ตี้ ดีเวลลอปเม้นท์ จำกัด (?PROP?)5) ธุรกิจด้านเอ็นเตอร์เทนเมนท์ (Entertainment) ดำเนินการโดยบริษัท มอร์ แดน เอ็นเตอร์เทน จำกัด (""MDE"") บริษัทย่อยโดยได้รับการแต่งตั้งจากบริษัท มอร์ รีเทิร์น จำกัด (มหาชน) ให้เป็นตัวแทนในการบริหารงานคอนเสิร์ต และได้จัดหาผู้ร่วมทุนเพื่อการดำเนินการจัดคอนเสิร์ต Rolling Lound ที่จัดขึ้นในเดือนเมษายน 2566",http://www.morereturn.co.th/,https://weblink.set.or.th/dat/f56/1114ONE250320261102010532T.zip,2026-05-13T13:04:14
SET,COMM,MOSHI,บริษัท โมชิ โมชิ รีเทล คอร์ปอเรชั่น จำกัด (มหาชน),"ธุรกิจร้านค้าปลีกสินค้าที่ตอบสนองต่อลักษณะการใช้ชีวิตประจำวันของผู้บริโภคแต่ละกลุ่ม (สินค้าไลฟ์สไตล์) ภายใต้ชื่อทางการค้า ""Moshi Moshi""",http://www.moshimoshi.co.th/,https://weblink.set.or.th/dat/f56/1741E1N240320261318360557T.zip,2026-05-13T13:04:33
mai,SERVICE,MOTHER,บริษัท มาเธอร์ มาร์เก็ตติ้ง จำกัด (มหาชน),ค้าปลีกและค้าส่งสินค้าอุปโภคบริโภค,http://www.mothermarket.co.th/,https://weblink.set.or.th/dat/f56/2010E1N300320262202500619T.zip,2026-05-13T13:03:21
SET,PF&REIT,M-PAT,กองทุนรวมอสังหาริมทรัพย์เอ็มเอฟซี ป่าตอง เฮอริเทจ,"ลงทุนในกรรมสิทธิ์ (Freehold) ห้องชุด จำนวน 183 ยูนิต ในอาคารชุด ""ป่าตองไนท์พลาซ่าร์"" ซึ่งปัจจุบันใช้ดำเนินธุรกิจโรงแรมภายใต้ชื่อ ""โรงแรมป่าตอง เฮอริเทจ"" (Patong Heritage Hotel) จำนวนห้องพัก 164 ห้อง รวมถึงอุปกรณ์ส่วนควบต่างๆ ตลอดจนทรัพย์สินที่เกี่ยวข้องกับโรงแรมป่าตอง เฮอริเทจ M-PAT ได้นำทรัพย์สินของโรงแรม ป่าตอง เฮอริเทจ จัดหาผลประโยชน์ โดยให้ บริษัท ป่าตอง เฮอริเทจ จำกัด เช่าเป็นระยะเวลา 2 ปี",http://www.mfcfund.com/,https://weblink.set.or.th/dat/annual/1191ANN170320261056340756T.zip,2026-05-13T13:03:24
mai,SERVICE,MPJ,บริษัท เอ็ม พี เจ โลจิสติกส์ จำกัด (มหาชน),ให้บริการโลจิสติกส์ครบวงจร ทั้งการขนส่งทางบกต่อเนื่องกับท่าเรือ การบริหารลานตู้คอนเทนเนอร์ การจัดการขนส่งระหว่างประเทศ (Freight Forwarder) และบริการคลังสินค้า,http://www.mpjlogistics.com/,https://weblink.set.or.th/dat/f56/1884E1N100320261719280552T.zip,2026-05-13T13:03:17
SET,COMM,MRDIYT,บริษัท มิสเตอร์. ดี.ไอ.วาย. โฮลดิ้ง (ประเทศไทย) จำกัด (มหาชน),"ประกอบธุรกิจโดยการถือหุ้นในบริษัทอื่น (Holding Company) ที่ประกอบธุรกิจค้าปลีกสินค้าประเภทอุปกรณ์ตกแต่งบ้านและสินค้าไลฟ์สไตล์ในประเทศไทยภายใต้ชื่อร้าน ""MR. D.I.Y.""",,https://weblink.set.or.th/dat/f56/2018ONE310320261449400175T.zip,2026-05-13T13:04:14
SET,ICT,MSC,บริษัท เมโทรซิสเต็มส์คอร์ปอเรชั่น จำกัด (มหาชน),บริษัทและบริษัทย่อยเป็นตัวแทนจำหน่ายเครื่องคอมพิวเตอร์และโปรแกรมคอมพิวเตอร์ วัสดุสิ้นเปลือง อุปกรณ์สำนักงาน และการบริการที่เกี่ยวข้อง,http://www.metrosystems.co.th/,https://weblink.set.or.th/dat/f56/0569E1N020320261720400826T.zip,2026-05-13T13:03:27
SET,FIN,MST,บริษัทหลักทรัพย์ เมย์แบงก์ (ประเทศไทย) จำกัด (มหาชน),บริษัทหลักทรัพย์,http://www.maybank.co.th/,https://weblink.set.or.th/dat/f56/0744ONE270320261821230780T.zip,2026-05-13T13:03:35
SET,PF&REIT,M-STOR,กองทุนรวมอสังหาริมทรัพย์เอ็มเอฟซี-สแตรทิจิกสโตเรจฟันด์,ลงทุนโดยซื้อกรรมสิทธิ์ในอสังหาริมทรัพย์ (freehold) ประกอบด้วยที่ดินพร้อมสิ่งปลูกสร้าง และอุปกรณ์ ของบริษัท สยามนิปปอน เอ็นจิเนียริ่งพาร์ท จำกัด บริษัทเกษตรเหนือ จำกัด บริษัท อะกรีเวิลด์ จำกัด และบริษัท พี.พี.ฟูดส์ ซัพพลาย จำกัด ซึ่งประกอบกิจการห้องเย็น และการรับฝากสินค้า,http://www.mfcfund.com/,https://weblink.set.or.th/dat/annual/1013ANN250320261531450586T.zip,2026-05-13T13:04:56
SET,FIN,MTC,บริษัท เมืองไทย แคปปิตอล จำกัด (มหาชน),สินเชื่อทะเบียนรถ /สินเชื่อโฉนดที่ดิน / สินเชื่อส่วนบุคคล / สินเชื่อนาโนไฟแนนซ์ / สินเชื่อเช่าซื้อรถจักรยานยนต์ / สินเชื่อเพื่อการอุปโภค / ธุรกิจนายหน้าประกันวินาศภัย,http://www.muangthaicap.com/,https://weblink.set.or.th/dat/f56/1225E1N180320262008300666T.zip,2026-05-13T13:04:25
SET,INSUR,MTI,บริษัท เมืองไทยประกันภัย จำกัด (มหาชน),รับประกันวินาศภัย ได้แก่ การรับประกันอัคคีภัย การรับประกันภัยทางทะเลและขนส่ง การรับประกันภัยรถยนต์ และการรับประกันภัยเบ็ดเตล็ด,http://www.muangthaiinsurance.com/,https://weblink.set.or.th/dat/f56/0985E1N230320262214100580T.zip,2026-05-13T13:04:40
mai,INDUS,MTW,บริษัท เมคทูวิน โฮลดิ้ง จำกัด (มหาชน),ผลิตและจำหน่ายเสื้อผ้าสำเร็จรูป และรถจักรยานยนต์ไฟฟ้า,http://www.maketowin.com/,https://weblink.set.or.th/dat/f56/1734E1N310320262216370538T.zip,2026-05-13T13:03:31
