market,sector,symbol,symbol_name,description,link_website,one_report_link,last_updated_at
SET,PKG,SLP,บริษัท สาลี่ พริ้นท์ติ้ง จำกัด (มหาชน),ดำเนินธุรกิจรับผลิตฉลากสินค้าและงานพิมพ์คุณภาพสูง โดยใช้เครื่องจักรและเทคโนโลยีการพิมพ์ที่ทันสมัย ส่งผลให้ฉลากที่ผลิตออกมามีคุณภาพสูง,http://www.saleeprinting.com/,https://weblink.set.or.th/dat/f56/1253E1N310320261823060099T.zip,2026-05-13T13:11:11
mai,PROPCON,SMART,บริษัท สมาร์ทคอนกรีต จำกัด (มหาชน),"ผลิตและจำหน่ายคอนกรีตมวลเบาระบบอบไอน้ำภายใต้ความดันสูง เพื่อใช้ในงานก่อสร้างและงานกั้นผนังภายในอาคาร ภายใต้ชื่อ ""SMART บล็อคเย็น""",http://www.smartblock.co.th/,https://weblink.set.or.th/dat/f56/1199E1N050320261740530256T.zip,2026-05-13T13:09:30
mai,CONSUMP,SMD100,บริษัท เอสเอ็มดี ไรส์ จำกัด (มหาชน),ตัวแทนจำหน่ายเครื่องมือแพทย์และอุปกรณ์ทางการแพทย์ โดยนำเข้าจากผู้ผลิตต่างประเทศ เพื่อจัดจำหน่ายให้แก่สถานพยาบาลในประเทศและบุคคลทั่วไป รวมถึงให้บริการทางการแพทย์,http://www.smdrise.com/,https://weblink.set.or.th/dat/f56/1642ONE310320262156180848T.zip,2026-05-13T13:09:32
SET,STEEL,SMIT,บริษัท สหมิตรเครื่องกล จำกัด (มหาชน),ดําเนินธุรกิจนำเข้าและจัดจำหน่ายสินค้าอุตสาหกรรม วัตถุดิบ เครื่องจักรและอุปกรณ์สำหรับโรงงานอุตสาหกรรม,http://www.sahamit.co.th/,https://weblink.set.or.th/dat/f56/0843ONE170320261804310880T.zip,2026-05-13T13:09:08
SET,AGRI,SMO,บริษัท กลุ่มสมอทอง จำกัด (มหาชน),ธุรกิจผลิตและจำหน่ายน้ำมันปาล์มดิบ เมล็ดในปาล์ม และผลิตภัณฑ์พลอยได้จากกระบวนการผลิต และธุรกิจผลิตกระแสไฟฟ้าจากเชื้อเพลิงก๊าซชีวภาพ,http://www.smothonggroup.com/,https://weblink.set.or.th/dat/f56/2043ONE310320261919230829T.zip,2026-05-13T13:10:47
SET,PKG,SMPC,บริษัท สหมิตรถังแก๊ส จำกัด (มหาชน),ผลิตถังแก๊สปิโตรเลียมเหลว และถังทนความดันต่ำแบบต่างๆ,http://www.smpcplc.com/,https://weblink.set.or.th/dat/f56/0273E1N270220261733320303T.zip,2026-05-13T13:09:19
SET,ETRON,SMT,บริษัท สตาร์ส ไมโครอิเล็กทรอนิกส์ (ประเทศไทย) จำกัด (มหาชน),รับจ้างผลิตและประกอบชิ้นส่วนอิเล็กทรอนิกส์,http://www.starsmicro.com/,https://weblink.set.or.th/dat/f56/1015ONE230320261147140187T.zip,2026-05-13T13:09:28
SET,IMM,SNC,บริษัท เอส เอ็น ซี ฟอร์เมอร์ จำกัด (มหาชน),บริษัทและบริษัทย่อยผลิตชิ้นส่วนอุปกรณ์สำหรับเครื่องปรับอากาศที่ใช้สำหรับยานพาหนะ และเครื่องทำความเย็น รับจ้างผลิตและประกอบเครื่องปรับอากาศสำหรับที่อยู่อาศัย ทำความเย็น ซ่อมและผลิตแม่พิมพ์,http://www.sncformer.com/,https://weblink.set.or.th/dat/f56/0800ONE090320261941510037T.zip,2026-05-13T13:11:20
SET,FOOD,SNNP,บริษัท ศรีนานาพร มาร์เก็ตติ้ง จำกัด (มหาชน),ผลิตและจำหน่ายเครื่องดื่มและขนมขบเคี้ยว เช่น เยลลี่พร้อมดื่มและเยลลี่คาราจีแนน ภายใต้ตราสินค้าเจเล่ ปลาหมึกอบ ปลาหมึกเส้น และปลาเส้น ภายใต้ตราสินค้าเบนโตะ และขนมขึ้นรูปและขนมปังแท่งภายใต้ตราสินค้าดอกบัว โลตัส เป็นต้น,https://www.snnp.co.th/,https://weblink.set.or.th/dat/f56/1568ONE300320262021310222T.zip,2026-05-13T13:11:06
SET,FOOD,SNP,บริษัท เอส แอนด์ พี ซินดิเคท จำกัด (มหาชน),ธุรกิจร้านอาหารและร้านเบเกอรี รวมทั้งจำหน่ายผลิตภัณฑ์ แบ่งเป็น 1) ร้านอาหารและร้านเบเกอรีในประเทศ 2) ร้านอาหาร ในต่างประเทศ 3) ผลิตและจำหน่ายสินค้าเบเกอรี อาหารสำเร็จรูปแช่แข็ง ผ่านสาขาร้านอาหารและเบเกอรี่ และซุปเปอร์มาร์เก็ต รวมทั้งส่งสินค้าออกไปต่างประเทศ 4)ให้บริการที่เกี่ยวเนื่องอื่นๆ เช่น บริการจัดส่งอาหารถึงบ้าน และบริการรับจัดเลี้ยงนอกสถานที่,http://www.snpfood.com/,https://weblink.set.or.th/dat/f56/0146E1N230320262023380288T.zip,2026-05-13T13:11:24
SET,PERSON,SNPS,บริษัท สเปเชี่ยลตี้ เนเชอรัล โปรดักส์ จำกัด (มหาชน),ผลิตและจำหน่ายสารสกัดสมุนไพรมาตรฐาน และ รับจ้างพัฒนาและผลิตผลิตภัณฑ์เพื่อสุขภาพ ความงาม และสุขอนามัยภายใต้ตราสินค้าของลูกค้า (Original Design Manufacturer) และภายใต้ตราสินค้าของกลุ่มบริษัทฯ (Original Brand Manufacturer),http://www.snpspcl.com/,https://weblink.set.or.th/dat/f56/1873E1N270320262020490557T.zip,2026-05-13T13:09:44
SET,PROF,SO,บริษัท สยามราชธานี จำกัด (มหาชน),ประกอบธุรกิจใน 2 กลุ่มธุรกิจหลัก ได้แก่ 1.ธุรกิจให้บริการจัดหาบุคลากร (Outsourcing Services) ซึ่งแบ่งออกเป็น 2 ประเภท ได้แก่ (1) ธุรกิจบริการบริหารจัดการ ซึ่งประกอบด้วยการให้บริการจัดหาพนักงานขับรถยนต์ พนักงานสำนักงาน พนักงานช่างเทคนิค และบริการงานบันทึกข้อมูล (2) ธุรกิจบริการดูแลภูมิทัศน์ 2. ธุรกิจให้เช่าและบริการ เป็นการให้บริการรถยนต์ให้เช่าและให้เช่าอสังหาริมทรัพย์,https://www.siamrajathanee.com/page-for-ir/,https://weblink.set.or.th/dat/f56/1602ONE230320260943120371T.zip,2026-05-13T13:09:48
SET,CONS,SOLAR,บริษัท โซลาร์ตรอน จำกัด (มหาชน),ผลิตและจำหน่ายแผงเซลล์แสงอาทิตย์แบบต่าง ๆ และให้บริการออกแบบและติดตั้งระบบผลิตไฟฟ้าด้วยเซลล์แสงอาทิตย์ทุกรูปแบบ ทั้งในและต่างประเทศ,http://www.solartron.co.th/,https://weblink.set.or.th/dat/f56/0831E1N260320261920030572T.zip,2026-05-13T13:09:19
mai,SERVICE,SONIC,บริษัท โซนิค อินเตอร์เฟรท จำกัด (มหาชน),บริษัท โซนิค อินเตอร์เฟรท จำกัด (มหาชน) (?บริษัทฯ? หรือ ?SONIC?) ประกอบธุรกิจให้บริการจัดการระบบโลจิสติกส์ระหว่างประเทศแบบครบวงจร (International Logistics Services Provider) ให้บริการทั้งการนำเข้าและส่งออกทั้งทางทะเล และทางอากาศ ให้บริการด้านพิธีการกรมศุลกากร การขนส่งในประเทศ การขนส่งข้ามแดน (cross border) รวมถึงให้บริการศูนย์รวบรวมและกระจายสินค้า,http://www.sonic.co.th/,https://weblink.set.or.th/dat/f56/1457ONE310320261816570555T.zip,2026-05-13T13:10:59
SET,FOOD,SORKON,บริษัท ส. ขอนแก่นฟู้ดส์ จำกัด (มหาชน),บริษัทฯ เป็นผู้ผลิตและจำหน่ายอาหาร ซึ่งจำแนกธุรกิจหลักออกเป็น 4 ประเภทธุรกิจ คือ 1) ธุรกิจอาหารแปรรูปจากเนื้อสัตว์2) ธุรกิจอาหารทะเลแปรรูป3) ธุรกิจฟาร์มเลี้ยงสุกร4) ธุรกิจร้านอาหารประเภท Quick Service Restaurant (QSR) 5) ธุรกิจต่างประเทศ 6) ธุรกิจอื่นๆ,http://www.sorkon.co.th/,https://weblink.set.or.th/dat/f56/0345ONE200320261749420487T.zip,2026-05-13T13:09:31
SET,TOURISM,SPA,บริษัท สยามเวลเนสกรุ๊ป จำกัด (มหาชน),ธุรกิจเวลเนส เช่น การให้บริการ นวด สปา เพื่อสุขภาพและคลินิก,http://www.siamwellnessgroup.com/,https://weblink.set.or.th/dat/f56/1221E1N240320262202060216T.zip,2026-05-13T13:09:40
SET,PKG,SPACK,บริษัท เอส. แพ็ค แอนด์ พริ้นท์ จำกัด (มหาชน),ผลิตบรรจุภัณฑ์กระดาษ ประเภทกล่องกระดาษ ได้แก่ กล่องพิมพ์พาณิชย์หรือกล่องพิมพ์ออฟเซ็ท กล่องลูกฟูก,http://www.spack.co.th/,https://weblink.set.or.th/dat/f56/0768ONE310320261633420639T.zip,2026-05-13T13:11:35
SET,PROP,SPALI,บริษัท ศุภาลัย จำกัด (มหาชน),พัฒนาอสังหาริมทรัพย์ประเภท 1) ที่อยู่อาศัย ทั้งบ้านและที่ดินจัดสรร อาคารชุด ในทำเลทั่วเขตกรุงเทพมหานคร ปริมณฑล รวมถึงต่างจังหวัด 2) เพื่อการพาณิชย์ ได้แก่ อาคารสำนักงานให้เช่า และ 3) ธุรกิจรีสอร์ทโรงแรมในต่างจังหวัด,http://www.supalai.com/,https://weblink.set.or.th/dat/f56/0371E1N240320261336450660T.zip,2026-05-13T13:11:16
SET,COMM,SPC,บริษัท สหพัฒนพิบูล จำกัด (มหาชน),เป็นตัวแทนจำหน่ายสินค้าอุปโภคบริโภค ด้วยระบบโลจิสติกส์ที่ทันสมัย ครอบคลุมทุกช่องทางการขาย และมีเครือข่ายกว้างขวางในการกระจายสินค้าหลายรายการและหลากหลายแบรนด์สู่ครอบครัวคนไทยทั่วประเทศ,http://www.sahapat.co.th/,https://weblink.set.or.th/dat/f56/0035ONE260320261456450403T.zip,2026-05-13T13:11:42
SET,ENERG,SPCG,บริษัท เอสพีซีจี จำกัด (มหาชน),"ประกอบธุรกิจด้านการลงทุน โดยการถือหุ้นบริษัทในเครือ เพื่อดำเนินธุรกิจ 5 ด้าน ดังนี้(1) ธุรกิจลงทุนและพัฒนาโครงการผลิตไฟฟ้าจากพลังงานแสงอาทิตย์ (Solar Farm) ธุรกิจบริการรับเหมาก่อสร้างโซลาร์ฟาร์มแบบครบวงจร (?Engineering, Procurement and Construction: EPC?) และธุรกิจบริการด้านการปฏิบัติการ การบำรุงรักษา และการประมวลผลโซลาร์ฟาร์ม (?Operation, Maintenance and Monitoring: OM&M?)(2) ธุรกิจจำหน่ายและติดตั้งระบบผลิตไฟฟ้าพลังงานแสงอาทิตย์บนหลังคา (Solar Roof)(3) ผู้แทนจำหน่ายเครื่องแปลงกระแสไฟฟ้า (Inverter) อย่างเป็นทางการ (Authorized Sales Partnership) ของ SMA Solar Technology AG (SMA) ประเทศเยอรมนี(4) ธุรกิจลงทุนโครงการผลิตไฟฟ้าจากพลังงานแสงอาทิตย์ สำหรับใช้ในพื้นที่เมืองใหม่เขตพัฒนาพิเศษภาคตะวันออก (EEC) กำลังการผลิตติดตั้งรวมไม่น้อยกว่า500 เมกะวัตต์(5) ธุรกิจลงทุนในโครงการผลิตไฟฟ้าพลังงานแสงอาทิตย์ ณ ประเทศญี่ปุ่น",http://www.spcg.co.th/,https://weblink.set.or.th/dat/f56/0889ONE300320261708200471T.zip,2026-05-13T13:09:56
SET,AUTO,SPG,บริษัท สยามภัณฑ์กรุ๊ป จำกัด (มหาชน),กลุ่มบริษัทผลิตและจำหน่ายสินค้าประเภทน้ำมันหล่อลื่น และจาระบี สำหรับเครื่องยนต์และเครื่องจักรอุตสาหกรรม,http://www.siampangroup.com/,https://weblink.set.or.th/dat/f56/0613ONE270320260819280668T.zip,2026-05-13T13:09:59
SET,COMM,SPI,บริษัท สหพัฒนาอินเตอร์โฮลดิ้ง จำกัด (มหาชน),แบ่งเป็น 3 ประเภท คือ 1) ธุรกิจการลงทุนในธุรกิจสินค้าอุปโภค 2) ธุรกิจการลงทุนในธุรกิจอาหารและเครื่องดื่ม และ 3) ธุรกิจการพัฒนาสวนอุตสาหกรรมและลงทุนในธุรกิจอื่นๆ,http://www.spi.co.th/,https://weblink.set.or.th/dat/f56/0027ONE270320261403120754T.zip,2026-05-13T13:09:30
SET,ENERG,SPRC,บริษัท สตาร์ ปิโตรเลียม รีไฟน์นิ่ง จำกัด (มหาชน),"บริษัท สตาร์ ปิโตรเลียม รีไฟนนิ่ง จำกัด (มหาชน) หรือ SPRC ดำเนินธุรกิจโรงกลั่นน้ำมันในนิคมอุตสาหกรรมมาบตาพุด จังหวัดระยอง ซึ่งเป็นศูนย์กลางอุตสาหกรรมปิโตรเคมีของประเทศ โรงกลั่นของบริษัทฯ เป็นระบบคอมเพลกซ์พร้อมหน่วยปรับปรุงคุณภาพน้ำมัน กำลังการกลั่น 175,000 บาร์เรลต่อวัน ผลิตภัณฑ์หลัก ได้แก่ ก๊าซปิโตรเลียมเหลว น้ำมันเบนซินไร้สารตะกั่ว น้ำมันอากาศยาน น้ำมันดีเซล และน้ำมันเตาบริษัท สตาร์ ฟูเอลส์ มาร์เก็ตติ้ง จำกัด (SFL) มีเครือข่ายสถานีบริการคาลเท็กซ์ประมาณ 530 แห่ง และให้บริการลูกค้ากลุ่มพาณิชย์และอุตสาหกรรมกว่า 200 ราย ด้วยผลิตภัณฑ์น้ำมันเชื้อเพลิงครบวงจรครอบคลุมภาคคมนาคม การขนส่ง อุตสาหกรรม และภาคอากาศยาน",http://www.sprc.co.th/,https://weblink.set.or.th/dat/f56/1294E1N310320261111590498T.zip,2026-05-13T13:11:11
SET,ICT,SPREME,บริษัท สุพรีม ดิสทิบิวชั่น จำกัด (มหาชน),ประกอบธุรกิจด้านเทคโนโลยีสารสนเทศ และการสื่อสาร โดยเป็นผู้ออกแบบ ติดตั้ง และจัดจำหน่ายระบบเทคโนโลยีสารสนเทศ ระบบเครือข่าย อย่างครบวงจร (System Integrator) พร้อมทั้งให้บริการซ่อมแซม บำรุงรักษาและการให้เช่าอุปกรณ์,http://www.supreme.co.th/,https://weblink.set.or.th/dat/f56/1858E1N250320261809000698T.zip,2026-05-13T13:09:43
SET,PF&REIT,SPRIME,ทรัสต์เพื่อการลงทุนในสิทธิการเช่าอสังหาริมทรัพย์ เอส ไพรม์ โกรท,ลงทุนในสิทธิการเช่าที่ดินบางส่วนและพื้นที่สำนักงาน พื้นที่ห้องประชุม พื้นที่ส่วนกลาง ที่จอดรถ และงานระบบของอาคารซันทาวเวอร์สเป็นระยะเวลา 30 ปี นับตั้งแต่วันจดทะเบียนสิทธิการเช่าซึ่งคือวันที่ 18 มกราคม 2562,,https://weblink.set.or.th/dat/annual/1476ANN020420261559130874T.zip,2026-05-13T13:09:54
mai,SERVICE,SPTX,บริษัท เอสพีที เอกซ์ จำกัด (มหาชน),บริษัท เอสพีที เอกซ์ จำกัด (มหาชน) (?บริษัทฯ? หรือ ?SPTX?) ประกอบธุรกิจหลักโดยการถือหุ้นในบริษัทอื่น ที่ประกอบธุรกิจเกี่ยวกับธุรกิจหลักทรัพย์แบบครบวงจร และธุรกิจเทคโนโลยีทางด้านการเงิน (FINTECH) ธุรกิจการอบรมสัมมนาให้คำแนะนำและให้ความรู้ที่จำเป็นเกี่ยวกับการลงทุนในตลาดหุ้นทั้งทางออนไลน์และออฟไลน์ (Investment Academy) ธุรกิจการให้บริการแพลตฟอร์มการเรียนรู้ออนไลน์ (E-Learning Platform Solution) ที่ใช้ปัญญาประดิษฐ์ (Artificial Intelligence: AI) ธุรกิจให้บริการพัฒนาซอฟท์แวร์และแพลตฟอร์มต่าง ๆ รวมถึงการให้บริการพัฒนาสื่อการเรียนรู้ที่ใช้ AI และธุรกิจอื่นที่สนับสนุนหรือเกี่ยวเนื่อง,http://www.newsnetwork.co.th/,https://weblink.set.or.th/dat/f56/0795ONE080420261432510123T.zip,2026-05-13T13:11:49
mai,TECH,SPVI,บริษัท เอส พี วี ไอ จำกัด (มหาชน),บริษัทฯ ประกอบธุรกิจหลักเป็นหนึ่งในตัวแทนจำหน่าย (Reseller) ผลิตภัณฑ์ภายใต้ตราสินค้า Apple ทั้งคอมพิวเตอร์ ผลิตภัณฑ์ประเภท iOS และอุปกรณ์เสริมต่าง ๆ รวมทั้งเป็นตัวแทนจำหน่ายผลิตภัณฑ์ภายใต้ตราสินค้าอื่น ๆ ที่สามารถนำมาใช้กับผลิตภัณฑ์ Apple เป็นหลัก เพื่อที่จะรองรับความต้องการของลูกค้าได้ครบวงจร นอกจากนี้ บริษัทฯ ยังได้ขยายธุรกิจการบริการให้แก่ลูกค้า โดยมีศูนย์บริการสำหรับสินค้าภายใต้ตราผลิตภัณฑ์ Apple ในนาม iCenter,http://www.spvi.co.th/,https://weblink.set.or.th/dat/f56/1165E1N060320261959320231T.zip,2026-05-13T13:11:29
SET,CONS,SQ,บริษัท สหกลอิควิปเมนท์ จำกัด (มหาชน),ให้บริการงานด้านการทำเหมืองแร่อย่างครบวงจร โดยให้บริการทำเหมืองถ่านหินแบบบ่อเปิด (Open Pit Mining) ครอบคลุมงาน การวางแผนงานเหมืองและขนส่ง การปฎิบัติงานเปิดหน้าเหมือง การเป็นที่ปรึกษางานเหมือง และการบริการให้เช่าเครื่องจักรขนาดใหญ่และงานซ่อมบำรุง โดยปัจจุบันดำเนินโครงการเหมืองแม่เมาะโครงการ 8 และโครงการเหมืองหงสา ประเทศลาว,http://www.sahakol.com/,https://weblink.set.or.th/dat/f56/1310E1N310320261157360462T.zip,2026-05-13T13:11:56
