market,sector,symbol,symbol_name,description,link_website,one_report_link,last_updated_at
mai,PROPCON,DIMET,บริษัท ไดเมท (สยาม) จำกัด (มหาชน),บริษัทดำเนินธุรกิจผลิตและจำหน่ายผลิตภัณฑ์สีคุณภาพสูงสำหรับใช้ทาในงานอุตสาหกรรมและงานโครงเหล็กที่ใช้ในงานก่อสร้างต่างๆ อาทิ โรงงานอุตสาหกรรมปิโตรเคมี โรงกลั่นน้ำมัน โรงผลิตไฟฟ้า แท่นขุดเจาะน้ำมันและก๊าซในอ่าวไทย เพื่อป้องกันสนิมเหล็ก รวมไปถึงสีทาอาคาร สีเคลือบไม้ สีทาเฟอร์นิเจอร์ และสีอุตสาหกรรม เช่น สีพ่นถังก๊าซ เป็นต้น รวมถึงเป็นผู้ให้บริการไฟฟ้าทางเลือกอย่างยั่งยืนในอนาคต,http://www.dimetsiam.com/,https://weblink.set.or.th/dat/f56/0966ONE270320261916180700T.zip,2026-05-13T12:58:49
SET,ICT,DITTO,บริษัท ดิทโต้ (ประเทศไทย) จำกัด (มหาชน),ประกอบธุรกิจให้บริการทางด้านระบบบริหารจัดการเอกสารและข้อมูลแบบครบวงจร (Data & Document Management) การบริหารระบบงาน (Business Process Outsourcing) ดาต้าซิเคียวริตี้ (Data Security) เทคโนโลยีด้านสิ่งแวดล้อมและสภาพอากาศ (Green & Climate Technology) คาร์บอนเครดิต และรับเหมาวิศวกรรมด้านเทคโนโลยี (Technology Devices & Engineering),http://www.dittothailand.com/,https://weblink.set.or.th/dat/f56/1640E1N310320261455230271T.zip,2026-05-13T12:59:03
SET,TRANS,DMT,บริษัท ทางยกระดับดอนเมือง จำกัด (มหาชน),บริหารโครงการสัมปทานทางยกระดับดอนเมืองช่วงดินแดงจนถึงอนุสรณ์สถานแห่งชาติ โดยมีรายได้หลักจากการจัดเก็บค่าผ่านทางภายใต้สัญญาสัมปทานในรูปแบบ Build-Transfer-Operate (BTO) อายุสัมปทานสิ้นสุดวันที่ 11 กันยายน 2577,http://www.tollway.co.th/,https://weblink.set.or.th/dat/f56/1054E1N240320261900060588T.zip,2026-05-13T12:58:43
mai,CONSUMP,DOD,บริษัท ดีโอดี ไบโอเทค จำกัด (มหาชน),บริษัทดำเนินธุรกิจรับจ้างผลิตผลิตภัณฑ์เสริมอาหารภายใต้ตราสินค้าของลูกค้า,http://www.dodbiotech.com/,https://weblink.set.or.th/dat/f56/1428ONE190320261313010721T.zip,2026-05-13T12:58:40
SET,COMM,DOHOME,บริษัท ดูโฮม จำกัด (มหาชน),ค้าปลีก ค้าส่ง และให้บริการด้านวัสดุก่อสร้าง และอุปกรณ์ตกแต่งบ้านแบบครบวงจร,https://www.dohome.co.th/,https://weblink.set.or.th/dat/f56/1504ONE250320260920420669T.zip,2026-05-13T12:58:36
mai,PROPCON,DPAINT,บริษัท สีเดลต้า จำกัด (มหาชน),ผลิตและจำหน่ายผลิตภัณฑ์สีทาอาคาร,http://www.deltapaint.co.th/,https://weblink.set.or.th/dat/f56/1657ONE260320261640560958T.zip,2026-05-13T12:59:02
SET,PF&REIT,DREIT,ทรัสต์เพื่อการลงทุนในอสังหาริมทรัพย์และสิทธิการเช่าดุสิตธานี,กองทรัสต์เพื่อการลงทุนในอสังหาริมทรัพย์และสิทธิการเช่าดุสิตธานี,http://www.dtcreit.com/,https://weblink.set.or.th/dat/annual/1399ANN310320261643300699T.zip,2026-05-13T12:58:53
SET,CONMAT,DRT,บริษัท ผลิตภัณฑ์ตราเพชร จำกัด (มหาชน),เป็นผู้ผลิตและจำหน่ายผลิตภัณฑ์หลังคา แผ่นผนังและฝ้า ไม้สังเคราะห์ รวมทั้งสินค้าประกอบการติดตั้งหลังคาและสินค้าโครงสร้างของบ้าน พร้อมให้บริการถอดแบบและติดตั้งหลังคา ภายใต้เครื่องหมายการค้า ตราเพชร ตราหลังคา ตราอดามัส และตราเจียระไน,http://www.dbp.co.th/,https://weblink.set.or.th/dat/f56/0872ONE240320261703590900T.zip,2026-05-13T12:58:48
SET,ICT,DTCENT,บริษัท ดี.ที.ซี. เอ็นเตอร์ไพรส์ จำกัด (มหาชน),ออกแบบ วิจัย พัฒนา จัดจำหน่าย และให้บริการอุปกรณ์ติดตามยานพาหนะ (GPS Tracking) และพัฒนาระบบไอโอที (IoT Solution) และ Artificial Intelligence (AI) ครบวงจร รวมถึงวิจัยและพัฒนาระบบซอฟต์แวร์เพื่อการบริหารขนส่งและอื่นๆ ที่เกี่ยวข้อง,https://www.dtc.co.th/,https://weblink.set.or.th/dat/f56/1712E1N310320262042030860T.zip,2026-05-13T12:59:23
SET,HOME,DTCI,บริษัท ดี.ที.ซี.อินดัสตรี่ส์ จำกัด (มหาชน),ผลิตสินค้าประเภทเครื่องเขียน ได้แก่ ปากกาลูกลื่น เป็นสินค้าหลักภายใต้เครื่องหมายการค้า LANCER และ CANDY และผลิตสินค้าเครื่องเขียนอื่นๆ คือ ปากกาเคมี ดินสอดำ ดินสอสี และแท่นประทับตรา เป็นสินค้าเสริม,http://www.lancerth.com/,https://weblink.set.or.th/dat/f56/0296ONE310320262204340738T.zip,2026-05-13T12:58:59
SET,TOURISM,DUSIT,บริษัท ดุสิตธานี จำกัด (มหาชน),โรงแรม รับจ้างบริหารโรงแรม การศึกษา อาหาร และพัฒนาอสังหาริมทรัพย์,http://www.dusit.com/,https://weblink.set.or.th/dat/f56/0007ONE300320261857460630T.zip,2026-05-13T12:59:20
SET,ENERG,EA,บริษัท พลังงานบริสุทธิ์ จำกัด (มหาชน),บริษัทฯ และบริษัทย่อย ดำเนินธุรกิจหลัก 5 กลุ่ม ได้แก่ 1) กลุ่มธุรกิจไบโอดีเซล? ผลิต และจำหน่ายน้ำมันไบโอดีเซล (B100) กรีนดีเซล กลีเซอรีนบริสุทธิ์ ผลิตภัณฑ์พลอยได้? ผลิต และจำหน่ายสารเปลี่ยนสถานะ (Phase Change Material : PCM)2) กลุ่มธุรกิจโรงไฟฟ้าพลังงานหมุนเวียน? ผลิต และจำหน่ายกระแสไฟฟ้าจากพลังงานแสงอาทิตย์? ผลิต และจำหน่ายกระแสไฟฟ้าจากพลังงานลม3) กลุ่มธุรกิจแบตเตอรี่ลิเทียมไอออน? ธุรกิจพัฒนา ผลิตและจำหน่ายแบตเตอรี่ สำหรับยานยนต์ไฟฟ้า? ระบบกักเก็บพลังงาน (Energy Storage System : ESS)4) กลุ่มธุรกิจยานยนต์ไฟฟ้า? ธุรกิจพัฒนา ผลิตและจำหน่ายยานยนต์ไฟฟ้า? ธุรกิจบริการสถานีชาร์จยานยนต์ไฟฟ้า? ธุรกิจให้เช่าซื้อยานยนต์ไฟฟ้า5) กลุ่มธุรกิจอื่นๆ? ศูนย์ทดสอบแบตเตอรี่ ยานยนต์ไฟฟ้า และผลิตภัณฑ์อิเล็กทรอนิกส์? ธุรกิจวิจัยและพัฒนา? ธุรกิจให้บริการงานออกแบบ จัดหา ก่อสร้าง ติดตั้งแบบครบวงจร และบริหารจัดการโครงการ? ธุรกิจกำจัดขยะและโรงไฟฟ้าขยะ? ธุรกิจอื่นๆ,http://www.energyabsolute.co.th/,https://weblink.set.or.th/dat/f56/1118E1N310320261908510817T.zip,2026-05-13T12:58:50
SET,AUTO,EASON,บริษัท อีซึ่น แอนด์ โค จำกัด (มหาชน),ผลิตและจำหน่ายสีอุตสาหกรรม ได้แก่ สีพ่นรถจักรยานยนต์ หมึกพิมพ์ บรรจุภัณฑ์ สีเคลือบบรรจุภัณฑ์ สีอุตสาหกรรมอื่นๆ และ การลงทุน,http://www.easonplc.com/,https://weblink.set.or.th/dat/f56/0861ONE300320261038330115T.zip,2026-05-13T12:58:47
SET,FIN,EAST,บริษัท ตะวันออกพาณิชย์ลีสซิ่ง จำกัด (มหาชน),บริษัท ประกอบธุรกิจให้บริการสินเชื่อเช่าซื้อรถยนต์มือสอง และสินเชื่อให้เงินกู้แก่ผู้ประกอบการซื้อรถยนต์ (Car Loan) บริการรับต่อกรมธรรม์ประกันภัย และ พ.ร.บ.ผู้ประสบภัยทางรถยนต์ เปิดดำเนินกิจการมาตั้งแต่ปี 2527 และได้เป็นบริษัทจดทะเบียนในตลาดหลักทรัพย์ เมื่อ 1 มีนาคม 2547 บริษัทมีการรับต่อทะเบียนรถยนต์ กรมธรรม์ประกันภัย พ.ร.บ.คุ้มครองผู้ประสบภัยทางรถยนต์ และกรมธรรม์ประกันชีวิต ซึ่งเป็นการอำนวยความสะดวกให้แก่ลูกค้า อีกทั้งเป็นการเสริมรายได้ให้กับบริษัทอีกทางหนึ่ง ตลอดจนเป็นการป้องกันความเสี่ยงที่อาจจะเกิดขึ้นกับรถยนต์และชีวิตของผู้เช่าซื้อ ซึ่งเป็นหลักประกันในการให้สินเชื่อของบริษัท,http://www.eastautocash.com/,https://weblink.set.or.th/dat/f56/0767ONE240320260914440063T.zip,2026-05-13T12:59:12
SET,ENERG,EASTW,บริษัท จัดการและพัฒนาทรัพยากรน้ำภาคตะวันออก จำกัด (มหาชน),สาธารณูปโภคด้านน้ำ บริหาร และจัดการระบบท่อส่งน้ำดิบในพื้นที่ชายฝั่งทะเลภาคตะวันออก,http://www.eastwater.com/,https://weblink.set.or.th/dat/f56/0616ONE230320261616010833T.zip,2026-05-13T12:59:04
mai,CONSUMP,ECF,บริษัท อีสต์โคสท์เฟอร์นิเทค จำกัด (มหาชน),บริษัทฯ เป็นผู้ผลิตและจำหน่ายเฟอร์นิเจอร์จากไม้ปาร์ติเคิลบอร์ด ไม้เอ็มดีเอฟแบบประกอบด้วยตนเอง เฟอร์นิเจอร์ไม้ยางพารา กระดาษปิดผิว ไม้ยางพาราแปรรูปอบแห้ง และให้บริการตัดแผ่นปิดขอบไม้ (พีวีซี) เพื่อใช้เป็นวัตถุดิบในการผลิตเฟอร์นิเจอร์ นอกจากนี้บริษัทฯ ยังมีหนึ่งในบริษัทย่อยที่ลงทุนด้านพลังงานทดแทน,http://www.eastcoast.co.th/,https://weblink.set.or.th/dat/f56/1124E1N250320251302400771T.zip,2026-05-13T12:59:02
mai,CONSUMP,EFORL,บริษัท อี ฟอร์ แอล เอม จำกัด (มหาชน),บริษัทดำเนินธุรกิจหลักเป็นตัวแทนจำหน่ายเครื่องมือและอุปกรณ์ทางการแพทย์,http://www.eforl-aim.com/,https://weblink.set.or.th/dat/f56/1001E1N230320261159080773T.zip,2026-05-13T12:59:35
SET,ENERG,EGATIF,กองทุนรวมโครงสร้างพื้นฐาน โรงไฟฟ้าพระนครเหนือ ชุดที่ 1 การไฟฟ้าฝ่ายผลิตแห่งประเทศไทย,EGATIF ลงทุนในรายได้ค่าความพร้อมจ่ายในอนาคตของโรงไฟฟ้าพระนครเหนือ ชุดที่ 1 กำลังการผลิตไฟฟ้าตามสัญญา 670 เมกะวัตต์ เป็นระยะเวลา 20 ปี,http://www.ktam.co.th/,https://weblink.set.or.th/dat/annual/1265ANN200320261123140871T.zip,2026-05-13T12:59:10
SET,ENERG,EGCO,บริษัท ผลิตไฟฟ้า จำกัด (มหาชน),ประกอบธุรกิจด้านการลงทุนโดยการถือหุ้นในบริษัทต่าง ๆ (Holding company) ที่ประกอบธุรกิจ 1) ผลิตและจำหน่ายไฟฟ้าทั้งในฐานะรายใหญ่ (IPP-Independent Power Producer) และรายเล็ก (SPP-Small Power Producer) 2) ธุรกิจการให้บริการด้านเทคนิคการจัดการแก่โรงไฟฟ้าและโรงงานอุตสาหกรรมต่าง ๆ ทั้งในและต่างประเทศ,http://www.egco.com/,https://weblink.set.or.th/dat/f56/0465ONE180320261625590352T.zip,2026-05-13T12:59:33
SET,HELTH,EKH,บริษัท เอกชัยการแพทย์ จำกัด (มหาชน),"บริษัทประกอบกิจการสถานพยาบาลประเภทที่รับผู้ป่วยไว้ค้างคืน ในลักษณะโรงพยาบาลทั่วไป (General Hospital) ภายใต้ชื่อ ""โรงพยาบาลเอกชัย""",http://www.ekachaihospital.com/,https://weblink.set.or.th/dat/f56/1325ONE260320261930420682T.zip,2026-05-13T12:58:59
SET,CONS,EMC,บริษัท อีเอ็มซี จำกัด (มหาชน),ดำเนินธุรกิจทางด้านวิศวกรรมงานก่อสร้างและการวางระบบไฟฟ้าเครื่องกล ในแขนงต่าง ๆ ที่ครบวงจร โดยแบ่งสายงานเป็น 2 สายหลัก คือ งานด้านวิศวกรรมก่อสร้างทั่วไป และงานด้านวิศวกรรมระบบไฟฟ้าและเครื่องกล และพัฒนาอสังหาริมทรัพย์,http://www.emc.co.th/,https://weblink.set.or.th/dat/f56/0565ONE310320261611040167T.zip,2026-05-13T12:59:02
mai,PROPCON,EMPIRE,บริษัท ออริจิ้น โกลบอล เอมไพร์ จำกัด (มหาชน),จำหน่ายอุปกรณ์ระบบปรับอากาศและรับเหมาติดตั้งระบบวิศวกรรมประกอบอาคาร,https://www.orgempire.com/,https://weblink.set.or.th/dat/f56/1720ONE020420260844220880T.zip,2026-05-13T12:58:57
SET,ENERG,EP,บริษัท อีสเทอร์น พาวเวอร์ กรุ๊ป จำกัด (มหาชน),ประกอบธุรกิจ 2 ส่วนหลัก คือ 1) เป็นผู้ผลิตสิ่งพิมพ์ที่ดำเนินธุรกิจโรงพิมพ์ในลักษณะครบวงจร ตั้งแต่วางแผนการผลิตจนกระทังเข้าเล่มเป็นสิ่งพิมพ์สำเร็จรูป และ 2) การผลิตและจำหน่ายไฟฟ้าพลังงานหมุนเวียนทั้งในและต่างประเทศ นอกจากนี้ บริษัทฯ มีการลงทุนในบริษัทร่วม ซึ่งประกอบธุรกิจผลิตและจำหน่ายไฟฟ้าและไอน้ำ โดยโรงไฟฟ้ำแบบพลังงานความร้อนร่วม (Cogeneration),http://www.epco.co.th/,https://weblink.set.or.th/dat/f56/0344ONE310320262044370144T.zip,2026-05-13T12:59:24
SET,CONMAT,EPG,บริษัท อีสเทิร์นโพลีเมอร์ กรุ๊ป จำกัด (มหาชน),"EPG ประกอบธุรกิจหลักโดยการถือหุ้นในบริษัทอื่น (Holding Company) มีการลงทุนหลักในธุรกิจแปรรูปพลาสติก ได้แก่ (1) ธุรกิจผลิตและจำหน่ายฉนวนยางกันความร้อนและความเย็น ดำเนินการโดย บริษัท แอร์โรเฟลกซ์ จำกัด (AFC) ซึ่งเป็นบริษัทแกน ภายใต้เครื่องหมายการค้า ""AEROFLEX"" (2) ธุรกิจผลิตและจำหน่ายอุปกรณ์ชิ้นส่วนตกแต่งรถยนต์ ดำเนินการโดย บริษัท แอร์โรคลาส จำกัด (ARK) ภายใต้เครื่องหมายการค้า ""AEROKLAS"" และ (3) ธุรกิจผลิตและจำหน่ายบรรจุภัณฑ์พลาสติก ดำเนินการโดย บริษัท อีสเทิร์น โพลีแพค จำกัด (EPP) ภายใต้เครื่องหมายการค้า ""EPP""",http://www.epg.co.th/,https://weblink.set.or.th/dat/f56/1244ONE130620250800120816T.zip,2026-05-13T12:59:14
SET,TOURISM,ERW,บริษัท ดิ เอราวัณ กรุ๊ป จำกัด (มหาชน),บริษัทและบริษัทย่อยประกอบธุรกิจเกี่ยวกับการลงทุนพัฒนาและดำเนินธุรกิจโรงแรมที่สอดคล้องกับทำเล สถานที่ตั้ง และกลุ่มเป้าหมาย เป็นธุรกิจหลัก โดยมีธุรกิจอื่น ได้แก่ ธุรกิจพื้นที่ให้เช่า และธุรกิจบริหารอาคาร,http://www.theerawan.com/,https://weblink.set.or.th/dat/f56/0120ONE260320261038390205T.zip,2026-05-13T12:59:12
SET,PROP,ESTAR,บริษัท อีสเทอร์น สตาร์ เรียล เอสเตท จำกัด (มหาชน),ดำเนินธุรกิจหลักเกี่ยวกับการพัฒนาอสังหาริมทรัพย์เพื่อขาย หรือให้เช่า และธุรกิจสนามกอล์ฟ ในกรุงเทพมหานครและจังหวัดระยอง,http://www.estarpcl.com/,https://weblink.set.or.th/dat/f56/0381E1N100420261517290977T.zip,2026-05-13T12:59:48
SET,ENERG,ETC,บริษัท เอิร์ธ เท็ค เอนไวรอนเมนท์ จำกัด (มหาชน),ประกอบธุรกิจหลักผลิตและจำหน่ายไฟฟ้าจากโรงไฟฟ้าพลังงานทดแทน รวมทั้งธุรกิจให้บริการด้านการออกแบบวิศวกรรมโรงไฟฟ้า การจัดหาเครื่องจักรและอุปกรณ์โรงไฟฟ้า และการก่อสร้างโรงไฟฟ้าแบบครบวงจร,http://www.etcenvi.com/,https://weblink.set.or.th/dat/f56/1584ONE270320261707060580T.zip,2026-05-13T12:59:22
mai,SERVICE,ETE,บริษัท บูรพา เทคนิคอล เอ็นจิเนียริ่ง จำกัด (มหาชน),บริษัทประกอบธุรกิจบริการบริหารจัดการ ธุรกิจบริการงานวิศวกรรม ธุรกิจผลิตไฟฟ้าจากพลังงานทดแทน ได้แก่ จากพลังงานแสงอาทิตย์ และพลังงานหมุนเวียน (ชีวมวล) รวมถึงธุรกิจจัดจำหน่ายสินคาและบริการอื่น ๆ,http://www.eastern-groups.com/,https://weblink.set.or.th/dat/f56/1358E1N240320261844360193T.zip,2026-05-13T12:59:48
SET,TRANS,ETL,บริษัท ยูโรเอเชีย โทเทิล โลจิสติกส์ จำกัด (มหาชน),ประกอบธุรกิจโดยการถือหุ้นในบริษัทอื่น (Holding Company) ที่ประกอบธุรกิจหลักให้บริการขนส่งสินค้าข้ามพรมแดน (Cross-Border Transportation Carrier) ระหว่างประเทศไทยและประเทศในกลุ่มเอเชียตะวันออกเฉียงใต้ มาเลเซีย และจีน ที่มีการเชื่อมต่อพรมแดนทางถนนและรางรถไฟ,http://www.etl.co.th/,https://weblink.set.or.th/dat/f56/1839ONE200320260804010111T.zip,2026-05-13T12:59:11
mai,CONSUMP,EURO,บริษัท ยูโร ครีเอชั่นส์ จำกัด (มหาชน),บริษัทฯ ประกอบธุรกิจหลักเป็นตัวแทนนำเข้าและจัดจำหน่ายผลิตภัณฑ์เฟอร์นิเจอร์ ผลิตภัณฑ์สำหรับการตกแต่ง และอุปกรณ์ฟิตเนส จากแบรนด์ชั้นนำระดับลักชัวรี,http://www.eurocreations.co.th/,https://weblink.set.or.th/dat/f56/1859E1N270320261549120768T.zip,2026-05-13T12:59:13
SET,PROP,EVER,บริษัท เอเวอร์แลนด์ จำกัด (มหาชน),ธุรกิจอสังหาริมทรัพย์และธุรกิจโรงพยาบาล,http://www.everland.co.th/,https://weblink.set.or.th/dat/f56/0391ONE310320261730590887T.zip,2026-05-13T12:59:08
