market,sector,symbol,symbol_name,description,link_website,one_report_link,last_updated_at
SET,STEEL,2S,บริษัท 2 เอส เมทัล จำกัด (มหาชน),แปรรูปผลิตภัณฑ์เหล็กรูปพรรณ และธุรกิจจัดหาผลิตภัณฑ์เหล็กเพื่อจำหน่าย โดยมีจุดกระจายสินค้าครอบคลุมทั่วประเทศ,http://www.ss.co.th/,https://weblink.set.or.th/dat/f56/1008E1N270320261635180821T.zip,2026-05-13T12:54:23
SET,ICT,3BBIF,กองทุนรวมโครงสร้างพื้นฐานบรอดแบนด์อินเทอร์เน็ต สามบีบี,"3BBIF มีกรรมสิทธิ์ในทรัพย์สินเส้นใยแก้วนำแสงจำนวน 1,680,500 คอร์กิโลเมตร ซึ่งกองทุนซื้อจากบริษัท ทริปเปิลที บรอดแบนด์ จำกัด (มหาชน) (TTTBB) โดย TTTBB เป็นผู้เช่าทรัพย์สินเส้นใยแก้วนำแสงจำนวนร้อยละ 80 ตามสัญญาแก้ไขเพิ่มเติมและแทนที่สัญญาเช่าหลัก และกองทุนได้เข้าทำสัญญาแก้ไขเพิ่มเติมและแทนที่สัญญาบริหารดูแลและบำรุงรักษาทรัพย์สินกับ TTTBB โดยแต่งตั้งให้ TTTBB เป็นผู้จัดการและบริหารทรัพย์สินเส้นใยแก้วนำแสงเพื่อให้บริการซ่อมแซม บำรุงรักษา และบริหารจัดการทรัพย์สินเส้นใยแก้วนำแสงแทนกองทุน",https://www.3bb-if.com/,https://weblink.set.or.th/dat/annual/1248ANN310320261628240684T.zip,2026-05-13T12:54:20
mai,CONSUMP,88TH,บริษัท 88(ไทยแลนด์) จำกัด (มหาชน),ผลิตและจัดจำหน่าย กลุ่มผลิตภัณฑ์ดูแลเส้นผมและหนังศีรษะ กลุ่มผลิตภัณฑ์ดูแลผิว และกลุ่มผลิตภัณฑ์เครื่องสำอาง ภายใต้แบรนด์ตนเอง,http://www.88thailand.co.th/,https://weblink.set.or.th/dat/f56/2031E1N230320261553350667T.zip,2026-05-13T12:54:22
SET,PROP,A,บริษัท อารียา พรอพเพอร์ตี้ จำกัด (มหาชน),ธุรกิจอสังหาริมทรัพย์ แบ่งเป็น 3 ประเภท 1) โครงการบ้านเดี่ยว โดยจะขายที่ดินเปล่าซึ่งเป็นกรรมสิทธิ์ของบริษัท และรับจ้างปลูกสร้างบ้านบนที่ดินนั้น หรือขายที่ดินพร้อมบ้านสร้างเสร็จ 2) โครงการทาวน์เฮาส์ และ 3) โครงการคอนโดมิเนียม โดยเน้นทำเลใจกลางเมืองบริษัทมีการพัฒนาโครงการประเภทธุรกิจศูนย์การค้าหรือคอมมิวนิตี้มอลล์ ในชื่อว่า Pickadaily Bangkok,http://www.areeya.co.th/,https://weblink.set.or.th/dat/f56/0770ONE310320250918220580T.zip,2026-05-13T12:54:19
SET,PROP,A5,บริษัท แอสเซท ไฟว์ กรุ๊ป จำกัด (มหาชน),ประกอบธุรกิจลงทุนในบริษัทอื่น โดยมีนโยบายลงทุนในบริษัทที่ประกอบธุรกิจอสังหาริมทรัพย์ และธุรกิจที่เกี่ยวข้อง (Holding Company),http://www.assetfive.co.th/,https://weblink.set.or.th/dat/f56/0746ONE310320261600330353T.zip,2026-05-13T12:54:20
SET,FOOD,AAI,บริษัท เอเชี่ยน อะไลอันซ์ อินเตอร์เนชั่นแนล จำกัด (มหาชน),ธุรกิจรับจ้างผลิตและจำหน่ายอาหารสัตว์เลี้ยง (Pet food) อาหารพร้อมทานบรรจุภาชนะปิดผนึก (Human food) และผลิตภัณฑ์ผลพลอยได้จากการแปรรูปปลาทูน่า,http://www.asianalliance.co.th/,https://weblink.set.or.th/dat/f56/1723E1N260320251231220280T.zip,2026-05-13T12:54:20
SET,TRANS,AAV,บริษัท เอเชีย เอวิเอชั่น จำกัด (มหาชน),ประกอบธุรกิจด้านการลงทุนโดยการถือหุ้นในบริษัทอื่น (Holding Company) โดยในปัจจุบัน บริษัทถือหุ้นใน บริษัท ไทยแอร์เอเชีย จำกัดเพียงแห่งเดียว สำหรับบริษัท ไทยแอร์เอเชีย จำกัด ประกอบธุรกิจให้บริการสายการบินราคาประหยัด โดยมีรายได้หลักจากการให้บริการขนส่งผู้โดยสารแบบประจำ (Scheduled Passenger Services) และการให้บริการเสริม (Ancillary Services),http://www.aavplc.com/,https://weblink.set.or.th/dat/f56/1091ONE200320262140400327T.zip,2026-05-13T12:54:23
mai,RESOURC,ABM,บริษัท เอเชีย ไบโอแมส จำกัด (มหาชน),จัดหาและจัดจำหน่ายเชื้อเพลิงชีวมวล 6 กลุ่มหลัก ได้แก่ 1) กะลาปาล์ม 2) ไม้สับและส่วนอื่นๆของไม้ 3) ขี้กบ ขี้เลื่อย และฝุ่นไม้ 4) ชีวมวลอัดแท่ง 5) สินค้าอื่น เช่น แกลบ ใยปาล์ม ทะลายปาล์ม เหง้ามัน มันสำปะหลังเส้น แป้งมันสำปะหลัง เป็นต้น6) เชื้อเพลิงขยะมูลฝอย (Refuse Derived Fuel : RDF),http://www.asiabiomass.com/,https://weblink.set.or.th/dat/f56/1418E1N240320262155280410T.zip,2026-05-13T12:54:21
mai,FINCIAL,ACAP,บริษัท เอเชีย แคปปิตอล กรุ๊ป จำกัด (มหาชน),ธุรกิจการให้สินเชื่อ แบ่งเป็น สินเชื่อภาคธุรกิจ (Corporate Loan) และสินเชื่อรายย่อย (Retail Loan),http://www.acap.co.th/,https://weblink.set.or.th/dat/f56/0880ONE310320261921150316T.zip,2026-05-13T12:54:21
SET,ENERG,ACC,บริษัท แอดวานซ์ คอนเนคชั่น คอร์ปอเรชั่น จำกัด (มหาชน),ปัจจุบันได้ดำเนินธุรกิจเป็น 4 กลุ่มหลัก ได้แก่ 1.กลุ่มธุรกิจโครงสร้างพื้นฐาน ประกอบไปด้วย 1.1) ธุรกิจพลังงานและพลังงานทดแทน 1.2) ธุรกิจรับเหมาก่อสร้าง 2.กลุ่มธุรกิจการเงิน ประกอบไปด้วย 2.1) ธุรกิจการให้กู้ยืม 2.2) ธุรกิจบริหารสินทรัพย์ 3. กลุ่มธุรกิจการจัดจำหน่าย 4. กลุ่มธุรกิจอื่นๆ,http://acc-plc.com/,https://weblink.set.or.th/dat/f56/0342ONE310320261807480719T.zip,2026-05-13T12:54:37
SET,ENERG,ACE,บริษัท แอ๊บโซลูท คลีน เอ็นเนอร์จี้ จำกัด (มหาชน),ประกอบธุรกิจหลักโดยการถือหุ้นในบริษัทอื่น (Holding Company) ที่ประกอบธุรกิจผลิตและจำหน่ายไฟฟ้าและไอน้ำและธุรกิจอื่นที่สนับสนุนหรือเกี่ยวเนื่องโดยมีบริษัท แอ๊ดวานซ์ คลีน เพาเวอร์ จำกัด (ACP) ซึ่งประกอบธุรกิจโรงไฟฟ้าชีวมวลเป็นบริษัทแกน,http://www.ace-energy.co.th/,https://weblink.set.or.th/dat/f56/1472ONE310320261609150010T.zip,2026-05-13T12:54:32
SET,AUTO,ACG,บริษัท ออโตคอร์ป โฮลดิ้ง จำกัด (มหาชน),บริษัท ออโตคอร์ป โฮลดิ้ง จำกัด (มหาชน) (?บริษัท?) ประกอบธุรกิจโดยการถือหุ้นในบริษัทอื่น (Holding company) ที่ประกอบธุรกิจจำหน่ายและให้บริการในอุตสาหกรรมรถยนต์ และธุรกิจที่เกี่ยวเนื่องอื่นๆ ปัจจุบัน บริษัทมีการลงทุนในบริษัทย่อย 2 แห่ง ดังนี้ 1. บริษัท ฮอนด้ามะลิวัลย์ จำกัด (?ฮอนด้ามะลิวัลย์?) เป็นบริษัทผู้จำหน่ายและศูนย์บริการรถยนต์ยี่ห้อฮอนด้า 2. บริษัท ออโตคลิกบายเอซีจี จำกัด (?ออโตคลิก?) ประกอบธุรกิจเป็นศูนย์บริการรถยนต์ทุกยี่ห้อประเภทเร่งด่วน (Fast Fit),http://www.autocorpgroup.com/,https://weblink.set.or.th/dat/f56/1474ONE310320262147230653T.zip,2026-05-13T12:54:34
mai,INDUS,ADB,บริษัท แอ็พพลาย ดีบี จำกัด (มหาชน),"บริษัท แอ็พพลาย ดีบี จำกัด (มหาชน) ""ADB"" ประกอบธุรกิจผลิตเม็ดพลาสติกคอมปาวด์ จำหน่ายให้กับโรงงานอุตสาหกรรมเพื่อใช้เป็นวัตถุดิบในการผลิตสายไฟ สายเคเบิ้ล พื้นรองเท้า ขอบคิ้วเฟอร์นิเจอร์ และบริษัทร่วม บริษัท เอดีบี ซีแลนท์ จำกัด ""ADBS"" ประกอบธุรกิจผลิตและจำหน่ายผลิตภัณฑ์กาว จำหน่ายให้กับโรงงานอุตสาหกรรมรองเท้า เฟอร์นิเจอร์ งานก่อสร้างและกลุ่มยานยนต์ ภายใต้ตราสินค้าของบริษัท และรับจ้างผลิตให้กับตราสินค้าชั้นนำ และผลิตภัณฑ์ยาแนวและกาวขนาดเล็ก โดยมีรูปแบบบรรจุภัณฑ์ขนาดใหญ่สำหรับใช้ในงานอุตสาหกรรม (bulk) ชนิดหลอด (Cartridge) และบรรจุภัณฑ์ขนาดเล็กสำหรับใช้ในครัวเรือน โดยมีการจำหน่ายให้กับลูกค้าทั้งในและต่างประเทศ",http://www.adb.co.th/,https://weblink.set.or.th/dat/f56/1384E1N160320261322240611T.zip,2026-05-13T12:54:32
mai,SERVICE,ADD,บริษัท แอดเทค ฮับ จำกัด (มหาชน),ให้บริการดิจิทัลคอนเทนต์ และบริการดิจิทัลโซลูชัน,https://www.addtechhub.com/,https://weblink.set.or.th/dat/f56/1641E1N160320261802260720T.zip,2026-05-13T12:54:32
SET,ICT,ADVANC,บริษัท แอดวานซ์ อินโฟร์ เซอร์วิส จำกัด (มหาชน),ให้บริการสื่อสารโทรคมนาคม โดยรวมถึงธุรกิจให้บริการโทรศัพท์เคลื่อนที่ ธุรกิจอินเทอร์เน็ตความเร็วสูง และธุรกิจดิจิทัล เซอร์วิส,http://investor.ais.co.th/,https://weblink.set.or.th/dat/f56/0268E1N100320261940590803T.zip,2026-05-13T12:54:29
SET,COMM,ADVICE,บริษัท แอดไวซ์ ไอที อินฟินิท จำกัด (มหาชน),จำหน่ายปลีก-ส่งสินค้าไอที เช่น คอมพิวเตอร์ประกอบ (D.I.Y) คอมพิวเตอร์โน้ตบุ๊ค (Notebook) คอมพิวเตอร์เดสก์ท็อป (Desktop) และอุปกรณ์เสริมต่างๆ รวมถึงสินค้ากลุ่มสมาร์ทโฟนและเครื่องใช้ไฟฟ้าภายในบ้าน ผ่านช่องทางสาขาและช่องทางออนไลน์ และให้บริการหลังการขายที่เกี่ยวเนื่องแบบครบวงจร,http://www.advicepcl.co.th/,https://weblink.set.or.th/dat/f56/1841E1N230320260853250772T.zip,2026-05-13T12:54:34
SET,ENERG,AE,บริษัท ออลล์ เอ็นเนอร์ยี่ แอนด์ ยูทิลิตี้ จำกัด (มหาชน),กลุ่มบริษัทประกอบธุรกิจหลัก 3 ธุรกิจ ได้แก่ 1) กลุ่มธุรกิจสถานีบริการแก๊สและน้ำมัน 2) กลุ่มธุรกิจพลังงานทดแทน 3) กลุ่มธุรกิจสาธารณูปโภค,http://www.aeu.co.th/,https://weblink.set.or.th/dat/f56/0670ONE230320262120050414T.zip,2026-05-13T12:54:32
SET,FIN,AEONTS,บริษัท อิออน ธนสินทรัพย์ (ไทยแลนด์) จำกัด (มหาชน),สินเชื่อบัตรเครดิต สินเชื่อส่วนบุคคล และสินเชื่อเช่าซื้อ,http://www.aeon.co.th/,https://weblink.set.or.th/dat/f56/0664E1N260620251743270762T.zip,2026-05-13T12:54:31
mai,FINCIAL,AF,บริษัท ไอร่า แฟคตอริ่ง จำกัด (มหาชน),ให้บริการสินเชื่อทั้งระยะสั้นและระยะยาวสำหรับธุรกิจ เช่น สินเชื่อแฟคตอริ่ง (รับซื้อลดลูกหนี้การค้า) . สินเชื่อเพื่อการลงทุนในสินทรัพย์ถาวร และสินเชื่อเพื่อเสริมสภาพคล่องหมุนเวียนในธุรกิจ,http://www.airafactoring.co.th/,https://weblink.set.or.th/dat/f56/0787E1N160320261735280321T.zip,2026-05-13T12:54:49
SET,FASHION,AFC,บริษัท เอเซียไฟเบอร์ จำกัด (มหาชน),ผลิตและจำหน่ายผลิตภัณฑ์ไนล่อนทั้งชนิดเม็ดและเส้นใย เพื่อใช้เป็นวัตถุดิบในอุตสาหกรรมปั่นด้าย ทอผ้าและถักผ้า มีผลิตภัณฑ์และบริการหลัก 5 ประเภท 1. เม็ดไนล่อน (Nylon Chip) ใช้เป็นวัตถุดิบในอุตสาหกรรมสิ่งทอและแหอวน 2. เส้นใยสังเคราะห์ (Filament Yarn) ใช้ในการทอผ้า และผลิตด้ายยืด 3. เส้นด้ายยืด (Textured Yarn) ใช้ผลิตผ้าถักและถุงเท้า 4. ผ้าย้อมและตกแต่ง (Fabric) ทอขึ้นจากเส้นใยสังเคราะห์และผ่านการฟอกย้อมและแต่งสำเร็จ 5. การบริการย้อมและตกแต่งผ้า (Service) ให้บริการแก่โรงงานอื่น,http://www.asiafiber.com/,https://weblink.set.or.th/dat/f56/0011E1N030920251443100859T.zip,2026-05-13T12:54:43
SET,ENERG,AGE,บริษัท เอเชีย กรีน เอนเนอจี จำกัด (มหาชน),ประกอบธุรกิจเป็นผู้จัดจำหน่ายถ่านหินสะอาด เพื่อจำหน่ายทั้งในประเทศ และต่างประเทศให้กับกลุ่มโรงงานอุตสาหกรรมต่าง ๆ และประกอบธุรกิจโลจิสติกส์ ทั้งทางบกโดยรถบรรทุกและทางน้ำโดยเรือลำเลียง,http://www.age.co.th/,https://weblink.set.or.th/dat/f56/0990ONE310320261747570490T.zip,2026-05-13T12:54:45
SET,AUTO,AH,บริษัท อาปิโก ไฮเทค จำกัด (มหาชน),ดำเนินธุรกิจใน 3 ธุรกิจหลัก ได้แก่I. ธุรกิจการผลิตชิ้นส่วนยานยนต์ ได้แก่ ชิ้นส่วน โลหะขึ้นรูป (Metal Forming) โครงช่วงล่างรถกระบะและชิ้นส่วนโครงสร้าง (Chassis & Structural) ชิ้นส่วนพลาสติกในรถยนต์ (Plastics Parts) ถังน้ำมันพลาสติกและถังพักน้ำฉีดกระจก (Fuel Tank & Washer System) ชิ้นส่วนโลหะตีอัดขึ้นรูปและกลึงเจียผิว (Forging & Machining) ชิ้นส่วนหล่อขึ้นรูปโลหะและกลึงเจียผิว (Casting & Machining) และอุปกรณ์จับยึดและแม่พิมพ์ปั๊มโลหะ (Assembly Jigs & Stamping Dies) II. ธุรกิจตัวแทนจำหน่ายรถยนต์และศูนย์บริการ หลังการขายIII. ธุรกิจให้บริการด้านเทคโนโลยี (Internet of Thing (IoT) Connectivity and Mobility),http://www.aapico.com/,https://weblink.set.or.th/dat/f56/0688E1N260320261957000800T.zip,2026-05-13T12:54:41
SET,HELTH,AHC,บริษัท โรงพยาบาลเอกชล จำกัด (มหาชน),โรงพยาบาล,http://www.aikchol.com/,https://weblink.set.or.th/dat/f56/0281E1N240320261753420202T.zip,2026-05-13T12:54:43
SET,ENERG,AI,บริษัท เอเชียน อินซูเลเตอร์ จำกัด (มหาชน),ผลิตและจำหน่ายลูกถ้วยไฟฟ้า,http://www.asianinsulators.com/,https://weblink.set.or.th/dat/f56/0790E1N160320261608170568T.zip,2026-05-13T12:54:41
SET,ENERG,AIE,บริษัท เอไอ เอนเนอร์จี จำกัด (มหาชน),ผู้ผลิตน้ำมันไบโอดีเซล น้ำมันพืช กลีเซอรีนบริสุทธิ์ และผลิตภัณฑ์ผลพลอยได้ จากน้ำมันปาล์มดิบ,http://www.aienergy.co.th/,https://weblink.set.or.th/dat/f56/1167E1N270220261247070266T.zip,2026-05-13T12:54:44
SET,PF&REIT,AIMCG,ทรัสต์เพื่อการลงทุนในอสังหาริมทรัพย์และสิทธิการเช่าอสังหาริมทรัพย์ เอไอเอ็ม คอมเมอร์เชียล โกรท,ลงทุนในสิทธิการเช่าและสิทธิการเช่าช่วงศูนย์การค้าคอมมูนิตี้มอลล์ 3 โครงการ ได้แก่ โครงการยูดี ทาวน์ โครงการ 72 คอร์ทยาร์ด และโครงการพอร์โต้ ชิโน่ และลงทุนในกรรมสิทธิ์ในห้องชุดซึ่งมีวัตถุประสงค์เพื่อการพาณิชย์ในโครงการ โนเบิล โซโล,http://www.aimcgreit.com/,https://weblink.set.or.th/dat/annual/1501ANN090420261754310586T.zip,2026-05-13T12:54:42
SET,PF&REIT,AIMIRT,ทรัสต์เพื่อการลงทุนในอสังหาริมทรัพย์และสิทธิการเช่าอสังหาริมทรัพย์ เอไอเอ็ม อินดัสเทรียล โกรท,ลงทุนในกรรมสิทธิ์ สิทธิการเช่า และสิทธิการเช่าช่วงในที่ดิน อาคารคลังสินค้า อาคารคลังห้องเย็น และถังเก็บสารเคมีเหลว รวมถึงอสังหาริมทรัพย์อื่นใดที่เกี่ยวข้องกับอสังหาริมทรัพย์ที่กองทรัสต์เข้าลงทุน,http://www.aimirt.com/,https://weblink.set.or.th/dat/annual/1406ANN090420261734370315T.zip,2026-05-13T12:54:43
mai,FINCIAL,AIRA,บริษัท ไอร่า แคปปิตอล จำกัด (มหาชน),ประกอบธุรกิจประเภทโฮลดิ้ง ลงทุนในบริษัทอื่น นโยบายการลงทุนของบริษัทฯ จะลงทุนในกิจการที่เกี่ยวข้องกับธุรกิจทางด้านการเงินเป็นหลัก ทั้งในกิจการที่เป็นบริษัทจดทะเบียนและไม่ได้จดทะเบียนในตลาดหลักทรัพย์ ในสัดส่วนไม่น้อยกว่า 75 ของเงินลงทุน และนอกเหนือจากธุรกิจการเงิน บริษัทฯสามารถลงทุนในธุรกิจอื่นๆ ได้ เพื่อกระจายความเสี่ยง แต่ต้องสัดส่วนไม่เกินร้อยละ 25 ของจำนวนเงินลงทุนทั้งหมด การลงทุนของบริษัทฯ จะเป็นการลงทุนทั้งในระยะสั้นและระยะยาว โดยรับผลตอบแทนเป็นเงินปันผลและกำไรจากการจำหน่ายเงินลงทุนเมื่อได้รับผลตอบแทนในระดับที่เหมาะสม ปัจจุบัน บริษํทฯ มีบริษัทย่อย 10 บริษัท และ บริษัทร่วม 2 บริษัท,https://www.airacapital.co.th/,https://weblink.set.or.th/dat/f56/1180ONE200320261742380353T.zip,2026-05-13T12:54:59
